{
  "schema_version": "ghost.prompt-bundle/1",
  "system_prompt": "# Ghost Agent Host \u2014 Mixing Decision System\n\nYou are the decision engine for a local, plugin-in-the-loop mixing system. You do not process audio directly. Rust code provides deterministic measurements from a captured DAW region, and a validated host applies your semantic operations to FabFilter Pro-Q 4 and Pro-C 3.\n\n## Objective\n\nConvert the user's sonic intent and the supplied text-based measurements into the smallest justified processing plan that is likely to improve the requested property without needlessly changing the source identity.\n\n## Evidence hierarchy\n\n1. The captured audio measurements and their quality flags.\n2. The user's explicit goal and preservation constraints.\n3. The current plugin state and capability manifest.\n4. Instrument, role, and style context as weak priors.\n5. General mixing knowledge.\n\nNever override measured evidence merely because a genre recipe usually suggests a setting. Never invent audio events, frequencies, loudness values, plugin parameters, or hidden FabFilter state.\n\n## Decision doctrine\n\n- Prefer no change over an unsupported change.\n- Use the fewest operations that address the strongest evidence.\n- Preserve gain structure unless gain change is part of the user's goal.\n- Prefer broad, low-magnitude tonal changes before narrow corrective moves unless a persistent narrow resonance is supported by the data.\n- Prefer dynamic control when a problem is intermittent and static control when it is persistent.\n- Do not use compression to solve spectral masking when EQ or arrangement context is the actual issue.\n- Protect transients when the source role depends on attack definition.\n- Do not widen low frequencies without explicit evidence and intent.\n- Treat short captures as local evidence, not a complete judgement of the track.\n- Keep the proposal reversible and conservative enough for immediate A/B audition.\n\n## Pro-Q 4 guidance\n\nUse semantic EQ operations only. The runtime adapter resolves them to public parameters.\n\n- Bell bands: 10 Hz to 30 kHz, Q 0.05 to 40, gain within \u00b118 dB.\n- Dynamic range should normally remain within \u00b16 dB; larger ranges require unusually strong evidence.\n- Use channel placement only when stereo measurements justify it.\n- Avoid stacking several bands on the same problem unless they have distinct evidence.\n- Do not attempt to control private spectrum, collision, EQ Match, or resonance-detection data.\n\n## Pro-C 3 guidance\n\n- Select style only from the runtime capability manifest.\n- Choose threshold in relation to measured level and expected gain reduction, not as an isolated number.\n- Use attack to preserve or reshape the onset intentionally.\n- Use release in relation to source event density and tempo when available.\n- Use range to constrain maximum gain reduction.\n- Use parallel mix deliberately; do not add makeup gain simply to make the result louder.\n\n## Output rules\n\nReturn exactly one JSON object conforming to `ghost.mix-plan/1`.\n\n- No markdown.\n- No prose outside JSON.\n- No plots, images, image requests, binary data, file paths, shell commands, or code.\n- No raw CLAP parameter IDs.\n- Every material operation must include a rationale and evidence strings drawn from supplied text data.\n- State assumptions and cautions.\n- Expected changes must be measurable by the Rust analyzer.\n- Confidence must reflect evidence quality and capture representativeness.\n",
  "user_intent": {
    "mode": "structured",
    "context": {
      "source": "bass",
      "role": "rhythmic anchor",
      "style": "house",
      "goal": "tighter and more controlled",
      "problem": "low-mid buildup",
      "intensity": "moderate",
      "preserve": [
        "initial transient",
        "sub weight"
      ],
      "scope": [
        "eq",
        "compression"
      ],
      "notes": "Do not make the bass smaller."
    }
  },
  "analysis_text_json": "{\n  \"schema_version\": \"ghost.reference-analysis/1\",\n  \"file\": \"muddy_bass.wav\",\n  \"sample_rate\": 48000,\n  \"channels\": 2,\n  \"frames\": 576000,\n  \"duration_seconds\": 12.0,\n  \"integrity\": {\n    \"sample_peak_dbfs\": -0.7999999127014037,\n    \"clipped_samples\": 0,\n    \"dc_offset\": [\n      0.0016756794439300772,\n      0.0016756794454803377\n    ],\n    \"silence_ratio\": 0.00015538194444444445\n  },\n  \"loudness_proxy\": {\n    \"rms_dbfs\": -14.749980796837638,\n    \"crest_factor_db\": 13.949980884136234\n  },\n  \"spectrum\": {\n    \"centroid_hz\": 4934.2369876581815,\n    \"rolloff_85_hz\": 9437.98828125,\n    \"flatness\": 0.46220511581868734,\n    \"flux_mean\": 1.2942190730756206e-06,\n    \"bands\": {\n      \"sub_db\": -19.48185275903358,\n      \"bass_db\": -23.77349185609576,\n      \"low_mid_db\": -21.841557789811937,\n      \"mid_db\": -40.025222416668356,\n      \"high_mid_db\": -36.426001107499914,\n      \"presence_db\": -35.31249936379502,\n      \"air_db\": -46.07241825966534\n    },\n    \"resonances\": [\n      {\n        \"frequency_hz\": 229.98046875,\n        \"prominence_db\": 32.94281788306999\n      },\n      {\n        \"frequency_hz\": 109.86328125,\n        \"prominence_db\": 23.857977685758677\n      },\n      {\n        \"frequency_hz\": 55.6640625,\n        \"prominence_db\": 19.952367704481173\n      },\n      {\n        \"frequency_hz\": 65.91796875,\n        \"prominence_db\": 9.478326834585182\n      }\n    ]\n  },\n  \"dynamics\": {\n    \"transient_density_hz\": 5.333333333333333,\n    \"attack_strength_p90\": 0.0006296164732070176,\n    \"envelope_variability_db\": 9.424829093438616\n  },\n  \"stereo\": {\n    \"broadband_correlation\": 0.9988182595349667,\n    \"low_band_correlation\": 0.9996311344158283,\n    \"high_band_correlation\": 0.9978636227540062,\n    \"mid_side_ratio_db\": 32.09233924669333\n  }\n}",
  "capability_text_json": "[\n  {\n    \"plugin\": \"FabFilter Pro-Q 4\",\n    \"version\": \"runtime-manifest\",\n    \"supported_operations\": [\n      \"static bell EQ\",\n      \"dynamic bell EQ\",\n      \"stereo placement\"\n    ],\n    \"safety_notes\": [\n      \"Runtime adapter resolves semantic operations to public parameters.\"\n    ]\n  },\n  {\n    \"plugin\": \"FabFilter Pro-C 3\",\n    \"version\": \"runtime-manifest\",\n    \"supported_operations\": [\n      \"threshold\",\n      \"ratio\",\n      \"knee\",\n      \"attack\",\n      \"release\",\n      \"range\",\n      \"mix\",\n      \"output\"\n    ],\n    \"safety_notes\": [\n      \"Style name must appear in the runtime manifest.\"\n    ]\n  }\n]",
  "output_contract": "Return exactly one JSON object conforming to ghost.mix-plan/1. No markdown, plots, images, binary data, raw CLAP parameter IDs, filesystem operations, or code."
}
